{
  "schema_version": "1.0",
  "round_id": "round_02",
  "n_trials": 50,
  "sampler": {
    "type": "TPESampler",
    "params": {
      "n_startup_trials": 10,
      "multivariate": true,
      "group": true
    },
    "seed": 42
  },
  "pruner": {
    "type": "MedianPruner",
    "params": {
      "n_startup_trials": 5,
      "n_warmup_steps": 10
    }
  },
  "search_space": {
    "top_k":         { "type": "int",   "low": 6,   "high": 14 },
    "chunk_size":    { "type": "int",   "low": 448, "high": 768, "step": 64 },
    "chunk_overlap": { "type": "float", "low": 0.1, "high": 0.3 },
    "temperature":   { "type": "float", "low": 0.0, "high": 0.2 }
  },
  "fixed_params": {
    "hybrid_alpha": 0.5,
    "rerank_model": "bge-reranker-large",
    "embed_model":  "text-embedding-3-large"
  },
  "stop_conditions": {
    "max_rounds": 5,
    "max_total_trials": 300,
    "target_value": null,
    "no_improvement_rounds": 2,
    "min_delta": 0.005
  },
  "provenance": {
    "kind": "llm_proposed",
    "source_round_id": "round_01",
    "source_bundle_hash": "__FILL_AT_ADAPTER__",
    "parent_config_hash": "__FILL_AT_ADAPTER__",
    "generated_at": "2026-04-23T10:15:00Z",
    "generated_by": {
      "tool": "claude_code",
      "model": "claude-opus-4-7",
      "prompt_version": "0.1.0",
      "prompt_path": "prompts/claude_code/propose_next_round.md"
    },
    "reviewer": {
      "kind": "human",
      "id": null,
      "approved_at": null,
      "comments": null
    },
    "rationale": "Round 01 importances concentrated on rerank_model (0.41) and embed_model (0.27); all 6 trials in clusters[0] use bge-reranker-large + text-embedding-3-large. Both frozen. Remaining 4 params narrowed to the convex hull of top trials with small buffers: top_k top trials span [8,12] → [6,14]; chunk_size top span [512,704] → [448,768]; chunk_overlap top span [0.15,0.25] → [0.1,0.3]; temperature top span [0.0,0.1] → [0.0,0.2]. Sampler / pruner unchanged — TPE handles the 4-dim space well and 15% pruning rate was balanced.",
    "diff_summary": [
      {
        "action": "freeze",
        "target": "rerank_model",
        "before": { "type": "categorical", "choices": ["none", "bge-reranker-base", "bge-reranker-large"] },
        "after":  "bge-reranker-large",
        "evidence": "param_importances.rerank_model=0.41; clusters[0].center.rerank_model=bge-reranker-large covers all top trials"
      },
      {
        "action": "freeze",
        "target": "embed_model",
        "before": { "type": "categorical", "choices": ["text-embedding-3-small", "text-embedding-3-large", "bge-m3"] },
        "after":  "text-embedding-3-large",
        "evidence": "param_importances.embed_model=0.27; top_trials 7,12,18,23,31,38 all use text-embedding-3-large"
      },
      {
        "action": "narrow",
        "target": "top_k",
        "before": { "type": "int", "low": 1,  "high": 20 },
        "after":  { "type": "int", "low": 6,  "high": 14 },
        "evidence": "top_trials span top_k in [8,12]; statistics.axis_coverage.top_k.sampled_min=3, sampled_max=14 so new band [6,14] sits inside the sampled range; statistics.boundary_hits.top_k.high=3 are all PRUNED/FAIL (sampled-but-poor, not unsampled)"
      },
      {
        "action": "narrow",
        "target": "chunk_size",
        "before": { "type": "int", "low": 128, "high": 1024, "step": 64 },
        "after":  { "type": "int", "low": 448, "high": 768,  "step": 64 },
        "evidence": "top_trials span chunk_size in [512,704]; statistics.axis_coverage.chunk_size.sampled_min=256, sampled_max=832 so new band [448,768] sits inside the sampled range; boundary_hits.chunk_size.high=2 only in PRUNED/FAIL"
      },
      {
        "action": "narrow",
        "target": "chunk_overlap",
        "before": { "type": "float", "low": 0.0, "high": 0.5 },
        "after":  { "type": "float", "low": 0.1, "high": 0.3 },
        "evidence": "top_trials span chunk_overlap in [0.15,0.25]; statistics.axis_coverage.chunk_overlap.sampled_min=0.1, sampled_max=0.4 so new band [0.1,0.3] sits inside the sampled range; boundary_hits.chunk_overlap.high=3 only in PRUNED/FAIL"
      },
      {
        "action": "narrow",
        "target": "temperature",
        "before": { "type": "float", "low": 0.0, "high": 1.0 },
        "after":  { "type": "float", "low": 0.0, "high": 0.2 },
        "evidence": "top_trials span temperature in [0.0,0.1]; statistics.axis_coverage.temperature.sampled_min=0.0, sampled_max=0.9 so new band [0.0,0.2] sits inside the sampled range; boundary_hits.temperature.low=6 concentrated at 0.0"
      }
    ]
  },
  "notes": "TEMPLATE — not a final schema-valid runtime output. The `provenance.source_bundle_hash` and `provenance.parent_config_hash` fields use the literal `__FILL_AT_ADAPTER__` sentinel, which the adapter replaces with a real sha256 at write time. For a schema-valid materialised example, see `round_02_config.json` in this directory. Freezing rerank_model and embed_model is a 'large change' per anti_patterns.md A7 — reviewer.kind=human required. approved_at left null so adapter will block execution until a human signs off."
}
